{
  "release_id": "eci-2026-07-30",
  "series_id": "entity-clarity-index",
  "title": "Entity Clarity Longitudinal Report — January to July 2026",
  "release_date": "2026-07-30",
  "baseline_date": "2026-01-20",
  "comparison_days": 191,
  "methodology_id": "eci-ecc-v1",
  "dataset_version": "2.0.0",
  "registry_entity_count": 745,
  "current_observation_count": 744,
  "matched_panel_count": 744,
  "current_coverage_pct": 0.998658,
  "excluded_from_matched_panel": [
    {
      "entity_id": "ent_cornerstone-research_80b9795e49",
      "entity_name": "Cornerstone Research",
      "reason": "No 2026-07-30 observation was supplied."
    }
  ],
  "source_qa": {
    "supplied_row_count": 747,
    "duplicate_rows_removed": 3,
    "encoding_repairs": [
      {
        "from": "ItaÃº Unibanco",
        "to": "Itaú Unibanco"
      }
    ],
    "change_column_mismatches": 0,
    "scoring_invariant_errors": 0
  },
  "summary": {
    "baseline_mean_ecc_matched_panel": 51.26,
    "current_mean_ecc_matched_panel": 52.43,
    "mean_ecc_change_matched_panel": 1.17,
    "baseline_median_ecc_matched_panel": 63,
    "current_median_ecc_matched_panel": 64,
    "positive_change_count": 204,
    "negative_change_count": 96,
    "unchanged_count": 444,
    "legibility_entries": 21,
    "legibility_exits": 22,
    "structural_movers": 97,
    "score_movers": 74,
    "drift": 95,
    "stable": 435
  },
  "industry_summary": [
    {
      "industry": "Media",
      "entities": 100,
      "stable": 45,
      "drift": 11,
      "score_movers": 14,
      "structural_movers": 21,
      "legibility_entries": 4,
      "legibility_exits": 5,
      "mean_delta_all": -0.15,
      "median_delta_all": 0,
      "median_delta_continuously_legible": 0,
      "baseline_blocked": 17,
      "current_blocked": 18,
      "current_high_capability": 31
    },
    {
      "industry": "Technology",
      "entities": 84,
      "stable": 54,
      "drift": 8,
      "score_movers": 6,
      "structural_movers": 12,
      "legibility_entries": 2,
      "legibility_exits": 2,
      "mean_delta_all": 2.261904761904762,
      "median_delta_all": 0,
      "median_delta_continuously_legible": 0,
      "baseline_blocked": 19,
      "current_blocked": 19,
      "current_high_capability": 17
    },
    {
      "industry": "Education",
      "entities": 100,
      "stable": 67,
      "drift": 15,
      "score_movers": 7,
      "structural_movers": 7,
      "legibility_entries": 3,
      "legibility_exits": 1,
      "mean_delta_all": 1.62,
      "median_delta_all": 0,
      "median_delta_continuously_legible": 0,
      "baseline_blocked": 8,
      "current_blocked": 6,
      "current_high_capability": 3
    },
    {
      "industry": "Consulting",
      "entities": 48,
      "stable": 25,
      "drift": 6,
      "score_movers": 6,
      "structural_movers": 7,
      "legibility_entries": 1,
      "legibility_exits": 3,
      "mean_delta_all": -0.3958333333333333,
      "median_delta_all": 0,
      "median_delta_continuously_legible": 0,
      "baseline_blocked": 9,
      "current_blocked": 11,
      "current_high_capability": 18
    },
    {
      "industry": "Energy",
      "entities": 50,
      "stable": 26,
      "drift": 8,
      "score_movers": 8,
      "structural_movers": 6,
      "legibility_entries": 2,
      "legibility_exits": 0,
      "mean_delta_all": 3.12,
      "median_delta_all": 0,
      "median_delta_continuously_legible": 0,
      "baseline_blocked": 9,
      "current_blocked": 7,
      "current_high_capability": 9
    },
    {
      "industry": "Restaurants & Hospitality",
      "entities": 46,
      "stable": 23,
      "drift": 7,
      "score_movers": 5,
      "structural_movers": 8,
      "legibility_entries": 1,
      "legibility_exits": 2,
      "mean_delta_all": 0.391304347826087,
      "median_delta_all": 0,
      "median_delta_continuously_legible": 0,
      "baseline_blocked": 12,
      "current_blocked": 13,
      "current_high_capability": 3
    },
    {
      "industry": "Fintech",
      "entities": 48,
      "stable": 24,
      "drift": 9,
      "score_movers": 6,
      "structural_movers": 8,
      "legibility_entries": 0,
      "legibility_exits": 1,
      "mean_delta_all": -0.4583333333333333,
      "median_delta_all": 0,
      "median_delta_continuously_legible": 0,
      "baseline_blocked": 5,
      "current_blocked": 6,
      "current_high_capability": 20
    },
    {
      "industry": "Marketplace",
      "entities": 41,
      "stable": 26,
      "drift": 3,
      "score_movers": 0,
      "structural_movers": 8,
      "legibility_entries": 2,
      "legibility_exits": 2,
      "mean_delta_all": 2.7804878048780486,
      "median_delta_all": 0,
      "median_delta_continuously_legible": 0,
      "baseline_blocked": 17,
      "current_blocked": 17,
      "current_high_capability": 9
    },
    {
      "industry": "Healthcare",
      "entities": 50,
      "stable": 31,
      "drift": 8,
      "score_movers": 4,
      "structural_movers": 4,
      "legibility_entries": 3,
      "legibility_exits": 0,
      "mean_delta_all": 5.78,
      "median_delta_all": 0,
      "median_delta_continuously_legible": 0,
      "baseline_blocked": 12,
      "current_blocked": 9,
      "current_high_capability": 9
    },
    {
      "industry": "E-Commerce & Retail",
      "entities": 41,
      "stable": 27,
      "drift": 4,
      "score_movers": 5,
      "structural_movers": 3,
      "legibility_entries": 0,
      "legibility_exits": 2,
      "mean_delta_all": -2.268292682926829,
      "median_delta_all": 0,
      "median_delta_continuously_legible": 0,
      "baseline_blocked": 5,
      "current_blocked": 7,
      "current_high_capability": 5
    },
    {
      "industry": "Financial",
      "entities": 44,
      "stable": 33,
      "drift": 2,
      "score_movers": 4,
      "structural_movers": 3,
      "legibility_entries": 1,
      "legibility_exits": 1,
      "mean_delta_all": -0.6136363636363636,
      "median_delta_all": 0,
      "median_delta_continuously_legible": 0,
      "baseline_blocked": 8,
      "current_blocked": 8,
      "current_high_capability": 5
    },
    {
      "industry": "Defense & Aerospace",
      "entities": 12,
      "stable": 6,
      "drift": 2,
      "score_movers": 1,
      "structural_movers": 1,
      "legibility_entries": 1,
      "legibility_exits": 1,
      "mean_delta_all": 3.3333333333333335,
      "median_delta_all": 0,
      "median_delta_continuously_legible": 0,
      "baseline_blocked": 3,
      "current_blocked": 3,
      "current_high_capability": 1
    },
    {
      "industry": "Artificial Intelligence",
      "entities": 11,
      "stable": 4,
      "drift": 3,
      "score_movers": 1,
      "structural_movers": 3,
      "legibility_entries": 0,
      "legibility_exits": 0,
      "mean_delta_all": 5.909090909090909,
      "median_delta_all": 0,
      "median_delta_continuously_legible": 1,
      "baseline_blocked": 1,
      "current_blocked": 1,
      "current_high_capability": 3
    },
    {
      "industry": "Cloud & Data Infrastructure",
      "entities": 9,
      "stable": 3,
      "drift": 2,
      "score_movers": 1,
      "structural_movers": 2,
      "legibility_entries": 0,
      "legibility_exits": 1,
      "mean_delta_all": -5.555555555555555,
      "median_delta_all": 1,
      "median_delta_continuously_legible": 1,
      "baseline_blocked": 1,
      "current_blocked": 2,
      "current_high_capability": 3
    },
    {
      "industry": "Government",
      "entities": 17,
      "stable": 11,
      "drift": 2,
      "score_movers": 1,
      "structural_movers": 2,
      "legibility_entries": 0,
      "legibility_exits": 1,
      "mean_delta_all": -1.6470588235294117,
      "median_delta_all": 0,
      "median_delta_continuously_legible": 0,
      "baseline_blocked": 2,
      "current_blocked": 3,
      "current_high_capability": 1
    },
    {
      "industry": "Sovereign Wealth Fund",
      "entities": 10,
      "stable": 6,
      "drift": 1,
      "score_movers": 1,
      "structural_movers": 1,
      "legibility_entries": 1,
      "legibility_exits": 0,
      "mean_delta_all": 9.3,
      "median_delta_all": 0,
      "median_delta_continuously_legible": 0,
      "baseline_blocked": 3,
      "current_blocked": 2,
      "current_high_capability": 3
    },
    {
      "industry": "Nuclear Energy",
      "entities": 8,
      "stable": 5,
      "drift": 1,
      "score_movers": 2,
      "structural_movers": 0,
      "legibility_entries": 0,
      "legibility_exits": 0,
      "mean_delta_all": 0.25,
      "median_delta_all": 0,
      "median_delta_continuously_legible": 0,
      "baseline_blocked": 0,
      "current_blocked": 0,
      "current_high_capability": 2
    },
    {
      "industry": "Telecommunications",
      "entities": 8,
      "stable": 5,
      "drift": 1,
      "score_movers": 1,
      "structural_movers": 1,
      "legibility_entries": 0,
      "legibility_exits": 0,
      "mean_delta_all": 0.75,
      "median_delta_all": 0,
      "median_delta_continuously_legible": 0,
      "baseline_blocked": 2,
      "current_blocked": 2,
      "current_high_capability": 2
    },
    {
      "industry": "Semiconductors & Industrial",
      "entities": 8,
      "stable": 6,
      "drift": 1,
      "score_movers": 1,
      "structural_movers": 0,
      "legibility_entries": 0,
      "legibility_exits": 0,
      "mean_delta_all": -1,
      "median_delta_all": 0,
      "median_delta_continuously_legible": 0,
      "baseline_blocked": 3,
      "current_blocked": 3,
      "current_high_capability": 3
    },
    {
      "industry": "Mining & Materials",
      "entities": 7,
      "stable": 6,
      "drift": 1,
      "score_movers": 0,
      "structural_movers": 0,
      "legibility_entries": 0,
      "legibility_exits": 0,
      "mean_delta_all": -0.14285714285714285,
      "median_delta_all": 0,
      "median_delta_continuously_legible": 0,
      "baseline_blocked": 1,
      "current_blocked": 1,